{
  "allowed_actions": [
    "open_public_listing",
    "open_public_resource_links",
    "extract_requirements",
    "capture_sanitized_text_evidence",
    "capture_public_screenshot_reference"
  ],
  "context": {
    "deadline": "2026-07-03T11:00:59.000Z",
    "resources": [
      "https://paj.cash",
      "https://paj.cash",
      "http://x.com/paj_cash",
      "https://github.com/paj-cash/paj_ramp/blob/main/lib/API_REFERENCE.md",
      "https://github.com/paj-cash/paj_ramp/blob/main/lib/API_REFERENCE.md",
      "https://developers.paj.cash",
      "https://developers.paj.cash",
      "https://t.me/+q1gJ8X-hTBQ4YWU0",
      "https://t.me/+q1gJ8X-hTBQ4YWU0"
    ],
    "reward_amount": 10000.0,
    "slug": "paj-video-content-bounty",
    "title": "Paj Video Content Bounty",
    "token": "USDG"
  },
  "created_at": "2026-06-24T00:31:56.000573+00:00",
  "evidence_required": [
    "current_listing_status",
    "deadline",
    "submission_requirements",
    "judging_criteria",
    "resource_links",
    "auth_or_credential_blockers"
  ],
  "forbidden_actions": [
    "submit_application",
    "post_to_social",
    "connect_wallet",
    "sign_transaction",
    "trade_stake_deposit_or_transfer",
    "store_cookie_token_secret_or_private_profile_data"
  ],
  "human_gate": {
    "reason": "External browser execution and every Superteam submission remain human-gated.",
    "required": true
  },
  "id": "superteam-paj-video-content-bounty-evidence",
  "objective": "Collect fresh public evidence and submission requirements for this Superteam opportunity without mutating external state.",
  "source": "organ-superteam",
  "url": "https://superteam.fun/earn/listing/paj-video-content-bounty/"
}
