{
  "allowed_actions": [
    "open_public_listing",
    "open_public_resource_links",
    "extract_requirements",
    "capture_sanitized_text_evidence",
    "capture_public_screenshot_reference"
  ],
  "context": {
    "deadline": "2026-07-01T02:59:59.000Z",
    "resources": [
      "https://github.com/solanabr/solana-ai-kit",
      "https://github.com/solanabr/crypto-legal-skill:",
      "https://github.com/solanabr/position-manager-skill",
      "https://github.com/solanabr/solana-auditor-skill",
      "https://github.com/solanabr/solana-game-skill",
      "https://github.com/solanabr/skill-bounty",
      "https://github.com/solanabr/skill-bounty",
      "https://github.com/solanabr/solana-ai-kit",
      "https://github.com/solanabr/solana-ai-kit",
      "https://github.com/solanabr/solana-game-skill",
      "https://github.com/solanabr/solana-game-skill",
      "https://github.com/solana-foundation/solana-dev-skill",
      "https://github.com/solana-foundation/eth-to-sol-skill",
      "https://github.com/sendaifun/skills",
      "https://github.com/jup-ag/agent-skills",
      "https://github.com/helius-labs/core-ai",
      "https://github.com/cloudflare/skills",
      "https://github.com/vercel-labs/agent-skills",
      "https://github.com/trailofbits/skills",
      "https://github.com/frankcastleauditor/safe-solana-builder",
      "https://github.com/QEDGen/solana-skills",
      "https://github.com/ColosseumOrg/colosseum-copilot",
      "https://github.com/sendaifun/solana-new"
    ],
    "reward_amount": 3000.0,
    "slug": "skills",
    "title": "Ship useful agent skills we can add to Solana AI Kit",
    "token": "USDG"
  },
  "created_at": "2026-06-24T00:31:56.001721+00:00",
  "evidence_required": [
    "current_listing_status",
    "deadline",
    "submission_requirements",
    "judging_criteria",
    "resource_links",
    "auth_or_credential_blockers"
  ],
  "forbidden_actions": [
    "submit_application",
    "post_to_social",
    "connect_wallet",
    "sign_transaction",
    "trade_stake_deposit_or_transfer",
    "store_cookie_token_secret_or_private_profile_data"
  ],
  "human_gate": {
    "reason": "External browser execution and every Superteam submission remain human-gated.",
    "required": true
  },
  "id": "superteam-skills-evidence",
  "objective": "Collect fresh public evidence and submission requirements for this Superteam opportunity without mutating external state.",
  "source": "organ-superteam",
  "url": "https://superteam.fun/earn/listing/skills/"
}
