{
  "allowed_actions": [
    "open_public_listing",
    "open_public_resource_links",
    "extract_requirements",
    "capture_sanitized_text_evidence",
    "capture_public_screenshot_reference"
  ],
  "context": {
    "deadline": "2026-07-04T03:59:59.000Z",
    "resources": [
      "https://x.com/mypipdev",
      "https://x.com/mypipdev",
      "https://www.mypip.dev/",
      "https://www.mypip.dev/",
      "https://mypipdev.com/",
      "https://mypipdev.com/"
    ],
    "reward_amount": 500.0,
    "slug": "write-a-banger-twitter-thread-about-mypip",
    "title": "Write a BANGER Twitter thread about myPip",
    "token": "USDC"
  },
  "created_at": "2026-06-24T00:31:29.122774+00:00",
  "evidence_required": [
    "current_listing_status",
    "deadline",
    "submission_requirements",
    "judging_criteria",
    "resource_links",
    "auth_or_credential_blockers"
  ],
  "forbidden_actions": [
    "submit_application",
    "post_to_social",
    "connect_wallet",
    "sign_transaction",
    "trade_stake_deposit_or_transfer",
    "store_cookie_token_secret_or_private_profile_data"
  ],
  "human_gate": {
    "reason": "External browser execution and every Superteam submission remain human-gated.",
    "required": true
  },
  "id": "superteam-write-a-banger-twitter-thread-about-mypip-evidence",
  "objective": "Collect fresh public evidence and submission requirements for this Superteam opportunity without mutating external state.",
  "source": "organ-superteam",
  "url": "https://superteam.fun/earn/listing/write-a-banger-twitter-thread-about-mypip/"
}
